19,RayMcGlynn,Leonardmouth,26,2019-07-29,3,2,5,3,4,4,1,false,Reiciendis quidem nihil. Quidem et sed ducimus quae atque omnis alias. Veniam sit qui autem harum doloremque autem accusantium excepturi. Et officiis rerum in quibusdam. In cum et maxime similique voluptatem quam.
19,ShaneUpton,Bogantown,1,2019-07-29,1,1,3,3,5,18,1,false,Qui labore quo accusantium sequi vero quo voluptas. Et ut accusantium animi accusantium nihil non facere. Eos suscipit et unde dolor quo quia ad consequatur est. Animi debitis rerum facilis. Sunt itaque omnis doloremque distinctio iusto facilis dolores ducimus corporis.
19,LinaGoodwin,East Jerrold,7,2019-07-29,2,2,2,5,4,0,1,true,Cum voluptatem sit illum. Enim eos ex vero a laborum ut. Magni et omnis incidunt aut sapiente sit omnis quos rerum. Dolorem eum ab. Voluptas enim reprehenderit dicta aut omnis.
19,BrandonHermann,Federicotown,26,2019-07-29,4,1,1,1,2,10,1,true,In est et sequi in vero quasi. Minus nostrum at eum et necessitatibus quisquam. Animi occaecati voluptatem esse. Maiores ut sequi nihil voluptas voluptate velit eaque. Suscipit iusto dolor perspiciatis quas et esse.
19,JohnRutherford,New Arnaldohaven,21,2019-07-29,3,1,5,5,4,3,3,false,Et fuga odit dolores odio cumque dicta excepturi. Repellendus dicta esse consequatur earum nisi id ullam ut ipsam. Pariatur sint et rem voluptas dolor similique occaecati explicabo. Veniam voluptatibus error deserunt dolore nam at qui eum aut. Eos incidunt numquam earum repellendus fugiat temporibus deleniti ratione maiores.
19,TierraAnderson,South Camrynstad,13,2019-07-29,4,3,5,5,3,4,1,true,Tempore impedit quidem quia eius eligendi aut delectus. Earum omnis deserunt aut quos dignissimos. A et accusantium animi natus illum quia fugit placeat. Harum praesentium laudantium et ut labore dolores.
19,BlancaBoehm,New Hardy,27,2019-07-29,1,1,5,3,4,1,3,true,Iusto nesciunt dicta dicta est distinctio. Fuga eius nisi qui aut minima dolores similique. Totam repudiandae consequatur in et. Nam magni minima voluptatibus non tempore dolorem.
19,TristonMurazik,Tadburgh,12,2019-07-29,3,3,5,4,2,15,1,false,Iste neque odio voluptas consequatur rerum. Est nihil corrupti saepe nobis. Eius dicta odio quia possimus et eligendi in accusantium.
19,AdrielBartoletti,Emanuelborough,2,2019-07-29,3,3,3,1,5,12,3,true,Voluptatem error illum et qui velit molestiae iusto qui sed. Recusandae aliquid aspernatur quae consequatur et. Est sunt ipsa voluptatem commodi corrupti molestiae earum omnis.
19,OpheliaPfeffer,North Orrinberg,20,2019-07-29,3,5,4,5,1,17,3,true,Consequatur architecto consequatur dolor non quos distinctio dolor doloremque. Reprehenderit quam optio. Dolorem aspernatur sapiente. Vero quia magnam voluptatum unde natus rem exercitationem sit.
19,RooseveltBauch,Rueckerburgh,18,2019-07-29,1,5,3,4,5,15,2,true,Modi dolor molestiae consequatur expedita eum saepe. Expedita laboriosam ut. Consectetur ipsum voluptas sunt eius.
19,NyahKulas,Eileenbury,5,2019-07-29,3,1,4,2,4,1,4,false,Quisquam quidem eveniet repudiandae magni. Error quod nulla quidem est hic omnis eum. Qui neque asperiores nesciunt exercitationem consequuntur. Cum repellendus qui minus dolores recusandae qui voluptas perspiciatis atque. Voluptas rerum animi pariatur beatae consectetur cumque officia.
19,CourtneyMuller,Sauerbury,6,2019-07-29,5,5,5,4,2,16,3,false,Omnis nemo consequatur. Consequatur at officia sunt. Hic quis eveniet deserunt eum consectetur est sapiente suscipit nihil. Animi ut aliquam laudantium quisquam ducimus. Sed libero earum ea esse rerum aspernatur voluptatem.
19,KileyYundt,Cordiachester,30,2019-07-29,1,2,2,3,2,12,2,true,Tempore corporis pariatur maiores alias magnam. Ratione explicabo ut. Totam harum quo eum et veritatis nihil quis inventore. Esse est et nulla. Sint recusandae veniam doloribus omnis porro ea minus quo.
19,KorbinRussel,North Kennethhaven,23,2019-07-29,2,2,2,3,5,6,3,false,Mollitia maxime illum et. Rem dolores suscipit est animi laudantium sed. Rem et voluptatem et delectus.
19,HazelJast,Armstrongville,15,2019-07-29,5,5,2,1,5,5,4,true,Exercitationem non quibusdam et dolorum sit rem consequatur iusto dolor. Non explicabo facilis architecto minus eum a dignissimos cumque incidunt. Eius itaque commodi illum.
19,JeanetteHintz,Jarredmouth,6,2019-07-29,1,2,2,5,5,17,3,true,Nihil temporibus eius ad nobis. Illum vitae voluptatem quae enim voluptates. Vitae ea commodi nulla eum quia provident quisquam.
19,RosalynLakin,Croninview,19,2019-07-29,5,2,4,3,2,12,1,false,Quia qui sit sed. Voluptatum est natus dicta et dicta dignissimos cum voluptas assumenda. Nesciunt error natus ratione. Velit vel culpa quis et doloremque tempore aut. Ut vel quia dolores qui veritatis suscipit totam aliquam vel. Neque quisquam et voluptates.
19,CarlosVandervort,North Albina,26,2019-07-29,1,3,5,2,2,4,2,false,Aut ex aspernatur totam possimus sed ipsum non quod accusamus. Nam tempore nemo facere qui. Modi quibusdam exercitationem quia non eligendi.
19,ChesleyLebsack,Harrisland,27,2019-07-29,5,4,2,5,5,10,4,false,Quis mollitia doloribus unde dolores asperiores hic voluptatem quia reprehenderit. Similique qui et pariatur enim et. In sunt fuga ea autem ea ut.
19,FayAltenwerth,Jaskolskimouth,12,2019-07-29,2,2,5,1,2,14,2,false,Odit ipsam explicabo quasi rerum magni. Ipsam dolore consequuntur dolorum ut aspernatur. Mollitia asperiores perferendis.
19,EarnestineRunolfsdottir,Strackeville,17,2019-07-29,3,4,3,3,4,6,1,true,Reprehenderit enim beatae totam laudantium quam totam sit et sint. Vel similique nihil exercitationem. Aut culpa eos dolorum sint molestias voluptas voluptas. Sequi nostrum harum libero qui quos magnam omnis iste. Sit voluptates quo dolore fuga dignissimos placeat. Nisi ipsa ab et voluptas consectetur qui aut impedit.
19,HailieHahn,Modestaville,30,2019-07-29,3,1,5,2,5,2,4,true,Qui aut reiciendis qui perspiciatis et non. Nihil nam vel. Est a inventore nemo vero voluptatem.
19,ZitaKuphal,West Brooklynberg,29,2019-07-29,5,5,3,3,2,16,2,true,Itaque commodi animi temporibus. Tenetur libero et. Sed delectus distinctio dolor et architecto perferendis cum. Vel fugiat nisi porro accusamus. Delectus itaque quo accusantium quo recusandae.
19,GildaEffertz,New Willard,30,2019-07-29,2,2,4,2,2,20,4,false,Tempora ducimus impedit. Aperiam aliquam ipsum et voluptatibus totam consequatur placeat dignissimos est. Fuga consequuntur animi. Enim sit sunt ratione corporis sed nulla aut illum.
19,AlbaLangosh,East Lindsayborough,23,2019-07-29,4,2,5,4,4,4,4,true,Laboriosam debitis ut omnis nisi porro a provident sit ut. Qui possimus doloremque sit quisquam officia. Quo necessitatibus et dolor ipsa sunt iste est. Ut quas molestias ducimus molestiae corporis. Quis omnis voluptas corporis ut nostrum rerum.
19,BrooksKozey,Vitoshire,11,2019-07-29,5,4,3,5,2,16,1,false,Et commodi qui maxime non consectetur aut veritatis magnam. Corporis ipsam unde rem enim veniam architecto. Ipsam placeat incidunt dolorem quod et nisi eum.
19,NathanialMante,Lake Madiefurt,13,2019-07-29,4,3,2,3,3,15,3,true,Doloremque dolores est eius et optio sit deserunt soluta quos. Quasi consequuntur ea dignissimos fuga laboriosam expedita ipsum explicabo laudantium. Quibusdam suscipit reprehenderit veritatis sint consectetur voluptatem itaque repellendus.
19,EvaGusikowski,North Ettie,27,2019-07-29,3,1,1,5,4,19,3,false,Nisi et excepturi earum error sed. Aut commodi illum quo similique reiciendis deleniti. Est repudiandae necessitatibus omnis unde ea enim recusandae aperiam totam. Excepturi non nulla est voluptas ut.
19,JessycaBuckridge,Ayanaport,21,2019-07-29,4,3,2,1,4,16,2,true,Voluptatem quo fugit. Illo et minus exercitationem. Deleniti eos sit animi. Enim nesciunt modi ipsam pariatur voluptas aliquid. Non aut aut. Aut facilis qui et sed labore consectetur qui velit fugit.
19,AgustinaKshlerin,South Garrison,29,2019-07-29,5,1,3,1,1,10,2,true,Aut suscipit quam. Cupiditate eum quas hic optio. Corporis consectetur ipsam dolore ut magnam quam voluptate sed molestias. Cupiditate adipisci saepe aliquam optio iure nihil repellendus. Amet minus distinctio amet.
19,HarryHomenick,Port Margotchester,11,2019-07-29,5,1,4,1,4,8,1,false,Id earum autem est accusantium. Sed et impedit. Itaque rerum quidem nesciunt laboriosam perspiciatis quibusdam enim excepturi.
19,JoshRosenbaum,East Gisselle,5,2019-07-29,4,2,3,5,4,2,1,true,Explicabo provident delectus omnis nostrum adipisci quia. Vero sit modi. Dolores id ducimus consectetur iste rem voluptatum quisquam odit. Voluptates dolorem provident assumenda rem et velit.
19,KorbinMcKenzie,Port Demetristown,2,2019-07-29,1,1,4,4,2,16,1,false,Quos ex voluptatum quaerat consectetur molestiae consequuntur molestiae. Odio vitae deleniti aut fugiat quia. Qui dicta sapiente.
19,RollinTorp,North Alexandreberg,19,2019-07-29,2,2,1,5,5,13,3,false,Ut est similique itaque a dolores perspiciatis et eum. Et ratione placeat. Sit ut rerum sit voluptatum. Ut et maiores. Ut rerum nulla sed qui explicabo omnis dolores dolore excepturi.
19,MasonSipes,West Jodystad,13,2019-07-29,1,4,5,4,3,3,3,true,Ea aut sapiente quasi ut iusto. Occaecati id omnis maxime fugiat voluptatem. Sequi quia accusamus magni laudantium facere. Non incidunt dolorum quam alias corporis. Consequatur eaque commodi sed ea. Aut tempore sed eos voluptatem.
19,EvangelineKlein,Tristinview,20,2019-07-29,1,5,5,5,3,5,4,false,Sunt libero ducimus ratione repudiandae quas. In impedit non quae. Ipsa molestiae repellat qui. Alias qui quia quia velit. Reiciendis autem voluptas ipsam ut soluta qui.
19,CarolineBahringer,Joannyfort,19,2019-07-29,2,3,2,1,2,4,4,true,Ipsam ea sunt iure qui tenetur dolor aut dolores in. Non et est nisi tempora voluptatem. Sunt enim similique itaque expedita assumenda magni necessitatibus qui dolor. Qui est aut. Non sequi at expedita quidem perspiciatis unde.
19,WainoHamill,Ryannburgh,5,2019-07-29,2,2,4,5,4,16,2,true,Qui qui itaque. Dolor doloribus nihil dolore. Id doloribus libero illo asperiores aperiam illo deleniti laudantium. Est quia atque voluptatum magnam delectus molestiae neque.
19,MeaghanStrosin,Lake Kellifurt,22,2019-07-29,2,2,5,5,4,4,1,true,Porro ipsum ducimus qui iure. Dicta id quia quae soluta. Enim eum soluta autem numquam fugit qui consequuntur. Voluptas omnis modi ut ab rem optio voluptatem. Sit aut in. Quae cumque voluptatum.
